{
  "id": "RC-0002",
  "ambiente": "AM-0021",
  "consulta": "CO-0003",
  "periodo": "todo",
  "modo": "termo",
  "cursor": null,
  "total_informado": 80,
  "total_visto": 80,
  "saturacao": "exaurido: 80 de 80 visto(s), passada completa e não saturada",
  "erros": [],
  "proxima_acao": "monitoramento: repetir e anotar só o não visto",
  "teto": {
    "chamadas": 3,
    "divisoes_janela": 4
  },
  "estado": "percorrido pela busca",
  "data": "2026-10-23",
  "origem_registro": {
    "criado_por": "scripts/recorte.py",
    "data": "2026-10-23",
    "execucao": "EX-0022",
    "versao_regra": "recorte-0.1"
  }
}
